{
  "meta": {
    "engine": "Pediatric Anemia Deterministic CDSS",
    "knowledgeBaseVersion": "0.1.0-2026-07-15",
    "evidenceReviewedThrough": "2026-07-15",
    "generatedAt": "x",
    "intendedUser": "Licensed health care professional",
    "status": "Research prototype—not clinically validated"
  },
  "classification": {
    "anemiaStatus": "indeterminate",
    "hemoglobin": 9.5,
    "hemoglobinLowerLimit": null,
    "morphology": "indeterminate",
    "mcv": 85,
    "mcvLowerLimit": null,
    "mcvUpperLimit": null,
    "rdw": 15,
    "rdwHigh": null,
    "reticulocyteResponse": "unknown",
    "thresholdSource": null,
    "ageBand": null
  },
  "alerts": [
    {
      "id": "SCOPE-001",
      "severity": "important",
      "title": "Neonatal/young-infant pathway required",
      "detail": "The built-in reference intervals begin at 6 months. Hemoglobin and MCV change rapidly in early infancy and depend on gestational/birth history.",
      "actions": [
        "Use local age-in-days/weeks and gestational-age reference intervals.",
        "Apply a neonatal/young-infant anemia pathway and involve neonatology/hematology as clinically indicated."
      ],
      "evidence": [
        "WHO2024_HB",
        "BLOOD2022_PED_ANEMIA"
      ]
    },
    {
      "id": "SCOPE-003",
      "severity": "important",
      "title": "Reference interval incomplete",
      "detail": "Anemia and/or morphology cannot be classified until hemoglobin and MCV limits are available.",
      "actions": [
        "Enter the reporting laboratory’s lower hemoglobin and MCV lower/upper limits."
      ],
      "evidence": [
        "AAP2026_IDA",
        "WHO2024_HB"
      ]
    }
  ],
  "rankedDifferential": [],
  "nextQuestions": [
    {
      "id": "Q-003",
      "priority": 3,
      "section": "cbc",
      "prompt": "What lower hemoglobin limit did the reporting laboratory use?",
      "why": "No safe built-in threshold is available for this age/sex configuration.",
      "evidence": [
        "AAP2026_IDA",
        "WHO2024_HB"
      ]
    },
    {
      "id": "Q-005",
      "priority": 6,
      "section": "cbc",
      "prompt": "Enter MCV and the local MCV lower/upper limits.",
      "why": "Morphology cannot be classified without MCV and appropriate limits.",
      "evidence": [
        "AAP2026_IDA",
        "BLOOD2022_PED_ANEMIA"
      ]
    }
  ],
  "interpretiveNotes": [],
  "limitations": [
    "This output is a deterministic clinical decision-support reference, not a diagnosis, treatment order, or substitute for examination and specialist judgment.",
    "The ranking is rule priority—not a calibrated probability, sensitivity, specificity, or risk score.",
    "Only supplied data are evaluated; missing, mistyped, or unit-mismatched data can materially change the output.",
    "Local laboratory reference intervals, specimen methods, and clinical context override built-in fallback intervals.",
    "Built-in CBC reference intervals are not validated for this age. A neonatal/young-infant or adult-specific pathway and local intervals are required."
  ],
  "provenance": {
    "evaluatedRuleCount": 91,
    "matchedRuleIds": [
      "SCOPE-001",
      "SCOPE-003",
      "Q-003",
      "Q-005"
    ],
    "ruleAudit": [
      {
        "ruleId": "SCOPE-001",
        "matched": true
      },
      {
        "ruleId": "SCOPE-002",
        "matched": false
      },
      {
        "ruleId": "SCOPE-003",
        "matched": true
      },
      {
        "ruleId": "ALERT-001",
        "matched": false
      },
      {
        "ruleId": "ALERT-002",
        "matched": false
      },
      {
        "ruleId": "ALERT-003",
        "matched": false
      },
      {
        "ruleId": "ALERT-004",
        "matched": false
      },
      {
        "ruleId": "ALERT-005",
        "matched": false
      },
      {
        "ruleId": "ALERT-006",
        "matched": false
      },
      {
        "ruleId": "ALERT-007",
        "matched": false
      },
      {
        "ruleId": "ALERT-008",
        "matched": false
      },
      {
        "ruleId": "ALERT-009",
        "matched": false
      },
      {
        "ruleId": "NOTE-001",
        "matched": false
      },
      {
        "ruleId": "NOTE-002",
        "matched": false
      },
      {
        "ruleId": "NOTE-003",
        "matched": false
      },
      {
        "ruleId": "NOTE-004",
        "matched": false
      },
      {
        "ruleId": "NOTE-005",
        "matched": false
      },
      {
        "ruleId": "NOTE-006",
        "matched": false
      },
      {
        "ruleId": "ID-001",
        "matched": false
      },
      {
        "ruleId": "ID-002",
        "matched": false
      },
      {
        "ruleId": "ID-003",
        "matched": false
      },
      {
        "ruleId": "ID-004",
        "matched": false
      },
      {
        "ruleId": "ID-005",
        "matched": false
      },
      {
        "ruleId": "ID-006",
        "matched": false
      },
      {
        "ruleId": "AINF-001",
        "matched": false
      },
      {
        "ruleId": "AINF-002",
        "matched": false
      },
      {
        "ruleId": "AINF-003",
        "matched": false
      },
      {
        "ruleId": "AINF-004",
        "matched": false
      },
      {
        "ruleId": "THAL-001",
        "matched": false
      },
      {
        "ruleId": "THAL-002",
        "matched": false
      },
      {
        "ruleId": "THAL-BETA-001",
        "matched": false
      },
      {
        "ruleId": "THAL-BETA-002",
        "matched": false
      },
      {
        "ruleId": "THAL-ALPHA-001",
        "matched": false
      },
      {
        "ruleId": "THAL-ALPHA-002",
        "matched": false
      },
      {
        "ruleId": "LEAD-001",
        "matched": false
      },
      {
        "ruleId": "LEAD-002",
        "matched": false
      },
      {
        "ruleId": "LEAD-003",
        "matched": false
      },
      {
        "ruleId": "SID-001",
        "matched": false
      },
      {
        "ruleId": "SID-002",
        "matched": false
      },
      {
        "ruleId": "LOSS-001",
        "matched": false
      },
      {
        "ruleId": "LOSS-002",
        "matched": false
      },
      {
        "ruleId": "LOSS-003",
        "matched": false
      },
      {
        "ruleId": "HEM-001",
        "matched": false
      },
      {
        "ruleId": "HEM-002",
        "matched": false
      },
      {
        "ruleId": "HEM-003",
        "matched": false
      },
      {
        "ruleId": "AIHA-001",
        "matched": false
      },
      {
        "ruleId": "HS-001",
        "matched": false
      },
      {
        "ruleId": "HS-002",
        "matched": false
      },
      {
        "ruleId": "G6PD-001",
        "matched": false
      },
      {
        "ruleId": "G6PD-002",
        "matched": false
      },
      {
        "ruleId": "G6PD-003",
        "matched": false
      },
      {
        "ruleId": "TMA-001",
        "matched": false
      },
      {
        "ruleId": "SICKLE-001",
        "matched": false
      },
      {
        "ruleId": "MAL-001",
        "matched": false
      },
      {
        "ruleId": "REN-001",
        "matched": false
      },
      {
        "ruleId": "TEC-001",
        "matched": false
      },
      {
        "ruleId": "PARVO-001",
        "matched": false
      },
      {
        "ruleId": "MARROW-001",
        "matched": false
      },
      {
        "ruleId": "MARROW-002",
        "matched": false
      },
      {
        "ruleId": "MARROW-003",
        "matched": false
      },
      {
        "ruleId": "MEG-001",
        "matched": false
      },
      {
        "ruleId": "MEG-002",
        "matched": false
      },
      {
        "ruleId": "COPPER-001",
        "matched": false
      },
      {
        "ruleId": "MACRO-001",
        "matched": false
      },
      {
        "ruleId": "MACRO-002",
        "matched": false
      },
      {
        "ruleId": "MACRO-003",
        "matched": false
      },
      {
        "ruleId": "MACRO-004",
        "matched": false
      },
      {
        "ruleId": "IMF-001",
        "matched": false
      },
      {
        "ruleId": "IMF-DBA-001",
        "matched": false
      },
      {
        "ruleId": "IMF-FANCONI-001",
        "matched": false
      },
      {
        "ruleId": "MIX-001",
        "matched": false
      },
      {
        "ruleId": "MIX-002",
        "matched": false
      },
      {
        "ruleId": "IRIDA-001",
        "matched": false
      },
      {
        "ruleId": "Q-001",
        "matched": false
      },
      {
        "ruleId": "Q-002",
        "matched": false
      },
      {
        "ruleId": "Q-003",
        "matched": true
      },
      {
        "ruleId": "Q-004",
        "matched": false
      },
      {
        "ruleId": "Q-005",
        "matched": true
      },
      {
        "ruleId": "Q-MICRO-001",
        "matched": false
      },
      {
        "ruleId": "Q-MICRO-002",
        "matched": false
      },
      {
        "ruleId": "Q-MICRO-003",
        "matched": false
      },
      {
        "ruleId": "Q-MICRO-004",
        "matched": false
      },
      {
        "ruleId": "Q-MICRO-005",
        "matched": false
      },
      {
        "ruleId": "Q-NORMO-HIGH-001",
        "matched": false
      },
      {
        "ruleId": "Q-NORMO-HIGH-002",
        "matched": false
      },
      {
        "ruleId": "Q-NORMO-LOW-001",
        "matched": false
      },
      {
        "ruleId": "Q-MACRO-001",
        "matched": false
      },
      {
        "ruleId": "Q-MACRO-002",
        "matched": false
      },
      {
        "ruleId": "Q-SMEAR-001",
        "matched": false
      },
      {
        "ruleId": "Q-CYT-001",
        "matched": false
      },
      {
        "ruleId": "ALERT-LEAD-CAPILLARY",
        "matched": false
      }
    ]
  }
}
