{
  "meta": {
    "engine": "Pediatric Anemia Deterministic CDSS",
    "knowledgeBaseVersion": "0.1.0-2026-07-15",
    "evidenceReviewedThrough": "2026-07-15",
    "generatedAt": "x",
    "intendedUser": "Licensed health care professional",
    "status": "Research prototype—not clinically validated"
  },
  "classification": {
    "anemiaStatus": "present",
    "hemoglobin": 9,
    "hemoglobinLowerLimit": 11.3,
    "morphology": "macrocytic",
    "mcv": 95,
    "mcvLowerLimit": 77.8,
    "mcvUpperLimit": 86.5,
    "rdw": null,
    "rdwHigh": null,
    "reticulocyteResponse": "high",
    "thresholdSource": "AAP2026_IDA",
    "ageBand": "6 to <12 years"
  },
  "alerts": [],
  "rankedDifferential": [
    {
      "id": "thyroid-liver-medication-macrocytosis",
      "label": "Non-megaloblastic macrocytosis pattern",
      "category": "macrocytic anemia",
      "summary": "Thyroid disease, liver disease, reticulocytosis, or medication exposure may produce macrocytosis without primary B12/folate deficiency.",
      "defaultNextSteps": [
        "Review TSH, liver tests, reticulocyte response, medication list, alcohol/toxin exposure where age-appropriate, and smear."
      ],
      "evidence": [
        "BLOOD2022_PED_ANEMIA"
      ],
      "level": "possible",
      "score": 40,
      "matchedRules": [
        "MACRO-004"
      ],
      "supportingFindings": [
        "Macrocytosis with elevated reticulocytes may reflect reticulocytosis rather than a primary megaloblastic process."
      ],
      "cautions": [],
      "nextSteps": [
        "Review TSH, liver tests, reticulocyte response, medication list, alcohol/toxin exposure where age-appropriate, and smear.",
        "Evaluate for hemolysis or blood loss before assigning a nutrient deficiency."
      ],
      "rank": 1
    }
  ],
  "nextQuestions": [
    {
      "id": "Q-MACRO-002",
      "priority": 11,
      "section": "macrocytic",
      "prompt": "Enter B12, folate, smear, TSH, liver tests, and relevant medication exposure.",
      "why": "These data separate megaloblastic from non-megaloblastic macrocytosis.",
      "evidence": [
        "BLOOD2022_PED_ANEMIA"
      ]
    },
    {
      "id": "Q-SMEAR-001",
      "priority": 15,
      "section": "smear",
      "prompt": "Has a peripheral smear been reviewed by an experienced laboratory professional?",
      "why": "Smear findings can identify hemolysis, blasts, abnormal morphology, and megaloblastic changes.",
      "evidence": [
        "BLOOD2022_PED_ANEMIA"
      ]
    }
  ],
  "interpretiveNotes": [],
  "limitations": [
    "This output is a deterministic clinical decision-support reference, not a diagnosis, treatment order, or substitute for examination and specialist judgment.",
    "The ranking is rule priority—not a calibrated probability, sensitivity, specificity, or risk score.",
    "Only supplied data are evaluated; missing, mistyped, or unit-mismatched data can materially change the output.",
    "Local laboratory reference intervals, specimen methods, and clinical context override built-in fallback intervals."
  ],
  "provenance": {
    "evaluatedRuleCount": 91,
    "matchedRuleIds": [
      "MACRO-004",
      "Q-MACRO-002",
      "Q-SMEAR-001"
    ],
    "ruleAudit": [
      {
        "ruleId": "SCOPE-001",
        "matched": false
      },
      {
        "ruleId": "SCOPE-002",
        "matched": false
      },
      {
        "ruleId": "SCOPE-003",
        "matched": false
      },
      {
        "ruleId": "ALERT-001",
        "matched": false
      },
      {
        "ruleId": "ALERT-002",
        "matched": false
      },
      {
        "ruleId": "ALERT-003",
        "matched": false
      },
      {
        "ruleId": "ALERT-004",
        "matched": false
      },
      {
        "ruleId": "ALERT-005",
        "matched": false
      },
      {
        "ruleId": "ALERT-006",
        "matched": false
      },
      {
        "ruleId": "ALERT-007",
        "matched": false
      },
      {
        "ruleId": "ALERT-008",
        "matched": false
      },
      {
        "ruleId": "ALERT-009",
        "matched": false
      },
      {
        "ruleId": "NOTE-001",
        "matched": false
      },
      {
        "ruleId": "NOTE-002",
        "matched": false
      },
      {
        "ruleId": "NOTE-003",
        "matched": false
      },
      {
        "ruleId": "NOTE-004",
        "matched": false
      },
      {
        "ruleId": "NOTE-005",
        "matched": false
      },
      {
        "ruleId": "NOTE-006",
        "matched": false
      },
      {
        "ruleId": "ID-001",
        "matched": false
      },
      {
        "ruleId": "ID-002",
        "matched": false
      },
      {
        "ruleId": "ID-003",
        "matched": false
      },
      {
        "ruleId": "ID-004",
        "matched": false
      },
      {
        "ruleId": "ID-005",
        "matched": false
      },
      {
        "ruleId": "ID-006",
        "matched": false
      },
      {
        "ruleId": "AINF-001",
        "matched": false
      },
      {
        "ruleId": "AINF-002",
        "matched": false
      },
      {
        "ruleId": "AINF-003",
        "matched": false
      },
      {
        "ruleId": "AINF-004",
        "matched": false
      },
      {
        "ruleId": "THAL-001",
        "matched": false
      },
      {
        "ruleId": "THAL-002",
        "matched": false
      },
      {
        "ruleId": "THAL-BETA-001",
        "matched": false
      },
      {
        "ruleId": "THAL-BETA-002",
        "matched": false
      },
      {
        "ruleId": "THAL-ALPHA-001",
        "matched": false
      },
      {
        "ruleId": "THAL-ALPHA-002",
        "matched": false
      },
      {
        "ruleId": "LEAD-001",
        "matched": false
      },
      {
        "ruleId": "LEAD-002",
        "matched": false
      },
      {
        "ruleId": "LEAD-003",
        "matched": false
      },
      {
        "ruleId": "SID-001",
        "matched": false
      },
      {
        "ruleId": "SID-002",
        "matched": false
      },
      {
        "ruleId": "LOSS-001",
        "matched": false
      },
      {
        "ruleId": "LOSS-002",
        "matched": false
      },
      {
        "ruleId": "LOSS-003",
        "matched": false
      },
      {
        "ruleId": "HEM-001",
        "matched": false
      },
      {
        "ruleId": "HEM-002",
        "matched": false
      },
      {
        "ruleId": "HEM-003",
        "matched": false
      },
      {
        "ruleId": "AIHA-001",
        "matched": false
      },
      {
        "ruleId": "HS-001",
        "matched": false
      },
      {
        "ruleId": "HS-002",
        "matched": false
      },
      {
        "ruleId": "G6PD-001",
        "matched": false
      },
      {
        "ruleId": "G6PD-002",
        "matched": false
      },
      {
        "ruleId": "G6PD-003",
        "matched": false
      },
      {
        "ruleId": "TMA-001",
        "matched": false
      },
      {
        "ruleId": "SICKLE-001",
        "matched": false
      },
      {
        "ruleId": "MAL-001",
        "matched": false
      },
      {
        "ruleId": "REN-001",
        "matched": false
      },
      {
        "ruleId": "TEC-001",
        "matched": false
      },
      {
        "ruleId": "PARVO-001",
        "matched": false
      },
      {
        "ruleId": "MARROW-001",
        "matched": false
      },
      {
        "ruleId": "MARROW-002",
        "matched": false
      },
      {
        "ruleId": "MARROW-003",
        "matched": false
      },
      {
        "ruleId": "MEG-001",
        "matched": false
      },
      {
        "ruleId": "MEG-002",
        "matched": false
      },
      {
        "ruleId": "COPPER-001",
        "matched": false
      },
      {
        "ruleId": "MACRO-001",
        "matched": false
      },
      {
        "ruleId": "MACRO-002",
        "matched": false
      },
      {
        "ruleId": "MACRO-003",
        "matched": false
      },
      {
        "ruleId": "MACRO-004",
        "matched": true
      },
      {
        "ruleId": "IMF-001",
        "matched": false
      },
      {
        "ruleId": "IMF-DBA-001",
        "matched": false
      },
      {
        "ruleId": "IMF-FANCONI-001",
        "matched": false
      },
      {
        "ruleId": "MIX-001",
        "matched": false
      },
      {
        "ruleId": "MIX-002",
        "matched": false
      },
      {
        "ruleId": "IRIDA-001",
        "matched": false
      },
      {
        "ruleId": "Q-001",
        "matched": false
      },
      {
        "ruleId": "Q-002",
        "matched": false
      },
      {
        "ruleId": "Q-003",
        "matched": false
      },
      {
        "ruleId": "Q-004",
        "matched": false
      },
      {
        "ruleId": "Q-005",
        "matched": false
      },
      {
        "ruleId": "Q-MICRO-001",
        "matched": false
      },
      {
        "ruleId": "Q-MICRO-002",
        "matched": false
      },
      {
        "ruleId": "Q-MICRO-003",
        "matched": false
      },
      {
        "ruleId": "Q-MICRO-004",
        "matched": false
      },
      {
        "ruleId": "Q-MICRO-005",
        "matched": false
      },
      {
        "ruleId": "Q-NORMO-HIGH-001",
        "matched": false
      },
      {
        "ruleId": "Q-NORMO-HIGH-002",
        "matched": false
      },
      {
        "ruleId": "Q-NORMO-LOW-001",
        "matched": false
      },
      {
        "ruleId": "Q-MACRO-001",
        "matched": false
      },
      {
        "ruleId": "Q-MACRO-002",
        "matched": true
      },
      {
        "ruleId": "Q-SMEAR-001",
        "matched": true
      },
      {
        "ruleId": "Q-CYT-001",
        "matched": false
      },
      {
        "ruleId": "ALERT-LEAD-CAPILLARY",
        "matched": false
      }
    ]
  }
}
