{
  "meta": {
    "engine": "Pediatric Anemia Deterministic CDSS",
    "knowledgeBaseVersion": "0.1.0-2026-07-15",
    "evidenceReviewedThrough": "2026-07-15",
    "generatedAt": "x",
    "intendedUser": "Licensed health care professional",
    "status": "Research prototype—not clinically validated"
  },
  "classification": {
    "anemiaStatus": "present",
    "hemoglobin": 9,
    "hemoglobinLowerLimit": 11.2,
    "morphology": "normocytic",
    "mcv": 82,
    "mcvLowerLimit": 78.3,
    "mcvUpperLimit": 87.7,
    "rdw": null,
    "rdwHigh": null,
    "reticulocyteResponse": "low",
    "thresholdSource": "AAP2026_IDA",
    "ageBand": "6 to <12 years"
  },
  "alerts": [],
  "rankedDifferential": [
    {
      "id": "renal-anemia",
      "label": "Renal/EPO-limited anemia pattern",
      "category": "production-limited normocytic anemia",
      "summary": "Normocytic anemia with an inappropriately low reticulocyte response and kidney disease/renal dysfunction supports a renal production-limited pattern.",
      "defaultNextSteps": [
        "Review renal function, urinalysis, blood pressure, inflammation, iron status, nutrition, and nephrology context."
      ],
      "evidence": [
        "BLOOD2022_PED_ANEMIA"
      ],
      "level": "strongly-supported",
      "score": 90,
      "matchedRules": [
        "REN-001"
      ],
      "supportingFindings": [
        "Normocytic anemia, an inappropriately low reticulocyte response, and kidney disease/abnormal creatinine were supplied."
      ],
      "cautions": [],
      "nextSteps": [
        "Review renal function, urinalysis, blood pressure, inflammation, iron status, nutrition, and nephrology context."
      ],
      "rank": 1
    }
  ],
  "nextQuestions": [],
  "interpretiveNotes": [],
  "limitations": [
    "This output is a deterministic clinical decision-support reference, not a diagnosis, treatment order, or substitute for examination and specialist judgment.",
    "The ranking is rule priority—not a calibrated probability, sensitivity, specificity, or risk score.",
    "Only supplied data are evaluated; missing, mistyped, or unit-mismatched data can materially change the output.",
    "Local laboratory reference intervals, specimen methods, and clinical context override built-in fallback intervals."
  ],
  "provenance": {
    "evaluatedRuleCount": 91,
    "matchedRuleIds": [
      "REN-001"
    ],
    "ruleAudit": [
      {
        "ruleId": "SCOPE-001",
        "matched": false
      },
      {
        "ruleId": "SCOPE-002",
        "matched": false
      },
      {
        "ruleId": "SCOPE-003",
        "matched": false
      },
      {
        "ruleId": "ALERT-001",
        "matched": false
      },
      {
        "ruleId": "ALERT-002",
        "matched": false
      },
      {
        "ruleId": "ALERT-003",
        "matched": false
      },
      {
        "ruleId": "ALERT-004",
        "matched": false
      },
      {
        "ruleId": "ALERT-005",
        "matched": false
      },
      {
        "ruleId": "ALERT-006",
        "matched": false
      },
      {
        "ruleId": "ALERT-007",
        "matched": false
      },
      {
        "ruleId": "ALERT-008",
        "matched": false
      },
      {
        "ruleId": "ALERT-009",
        "matched": false
      },
      {
        "ruleId": "NOTE-001",
        "matched": false
      },
      {
        "ruleId": "NOTE-002",
        "matched": false
      },
      {
        "ruleId": "NOTE-003",
        "matched": false
      },
      {
        "ruleId": "NOTE-004",
        "matched": false
      },
      {
        "ruleId": "NOTE-005",
        "matched": false
      },
      {
        "ruleId": "NOTE-006",
        "matched": false
      },
      {
        "ruleId": "ID-001",
        "matched": false
      },
      {
        "ruleId": "ID-002",
        "matched": false
      },
      {
        "ruleId": "ID-003",
        "matched": false
      },
      {
        "ruleId": "ID-004",
        "matched": false
      },
      {
        "ruleId": "ID-005",
        "matched": false
      },
      {
        "ruleId": "ID-006",
        "matched": false
      },
      {
        "ruleId": "AINF-001",
        "matched": false
      },
      {
        "ruleId": "AINF-002",
        "matched": false
      },
      {
        "ruleId": "AINF-003",
        "matched": false
      },
      {
        "ruleId": "AINF-004",
        "matched": false
      },
      {
        "ruleId": "THAL-001",
        "matched": false
      },
      {
        "ruleId": "THAL-002",
        "matched": false
      },
      {
        "ruleId": "THAL-BETA-001",
        "matched": false
      },
      {
        "ruleId": "THAL-BETA-002",
        "matched": false
      },
      {
        "ruleId": "THAL-ALPHA-001",
        "matched": false
      },
      {
        "ruleId": "THAL-ALPHA-002",
        "matched": false
      },
      {
        "ruleId": "LEAD-001",
        "matched": false
      },
      {
        "ruleId": "LEAD-002",
        "matched": false
      },
      {
        "ruleId": "LEAD-003",
        "matched": false
      },
      {
        "ruleId": "SID-001",
        "matched": false
      },
      {
        "ruleId": "SID-002",
        "matched": false
      },
      {
        "ruleId": "LOSS-001",
        "matched": false
      },
      {
        "ruleId": "LOSS-002",
        "matched": false
      },
      {
        "ruleId": "LOSS-003",
        "matched": false
      },
      {
        "ruleId": "HEM-001",
        "matched": false
      },
      {
        "ruleId": "HEM-002",
        "matched": false
      },
      {
        "ruleId": "HEM-003",
        "matched": false
      },
      {
        "ruleId": "AIHA-001",
        "matched": false
      },
      {
        "ruleId": "HS-001",
        "matched": false
      },
      {
        "ruleId": "HS-002",
        "matched": false
      },
      {
        "ruleId": "G6PD-001",
        "matched": false
      },
      {
        "ruleId": "G6PD-002",
        "matched": false
      },
      {
        "ruleId": "G6PD-003",
        "matched": false
      },
      {
        "ruleId": "TMA-001",
        "matched": false
      },
      {
        "ruleId": "SICKLE-001",
        "matched": false
      },
      {
        "ruleId": "MAL-001",
        "matched": false
      },
      {
        "ruleId": "REN-001",
        "matched": true
      },
      {
        "ruleId": "TEC-001",
        "matched": false
      },
      {
        "ruleId": "PARVO-001",
        "matched": false
      },
      {
        "ruleId": "MARROW-001",
        "matched": false
      },
      {
        "ruleId": "MARROW-002",
        "matched": false
      },
      {
        "ruleId": "MARROW-003",
        "matched": false
      },
      {
        "ruleId": "MEG-001",
        "matched": false
      },
      {
        "ruleId": "MEG-002",
        "matched": false
      },
      {
        "ruleId": "COPPER-001",
        "matched": false
      },
      {
        "ruleId": "MACRO-001",
        "matched": false
      },
      {
        "ruleId": "MACRO-002",
        "matched": false
      },
      {
        "ruleId": "MACRO-003",
        "matched": false
      },
      {
        "ruleId": "MACRO-004",
        "matched": false
      },
      {
        "ruleId": "IMF-001",
        "matched": false
      },
      {
        "ruleId": "IMF-DBA-001",
        "matched": false
      },
      {
        "ruleId": "IMF-FANCONI-001",
        "matched": false
      },
      {
        "ruleId": "MIX-001",
        "matched": false
      },
      {
        "ruleId": "MIX-002",
        "matched": false
      },
      {
        "ruleId": "IRIDA-001",
        "matched": false
      },
      {
        "ruleId": "Q-001",
        "matched": false
      },
      {
        "ruleId": "Q-002",
        "matched": false
      },
      {
        "ruleId": "Q-003",
        "matched": false
      },
      {
        "ruleId": "Q-004",
        "matched": false
      },
      {
        "ruleId": "Q-005",
        "matched": false
      },
      {
        "ruleId": "Q-MICRO-001",
        "matched": false
      },
      {
        "ruleId": "Q-MICRO-002",
        "matched": false
      },
      {
        "ruleId": "Q-MICRO-003",
        "matched": false
      },
      {
        "ruleId": "Q-MICRO-004",
        "matched": false
      },
      {
        "ruleId": "Q-MICRO-005",
        "matched": false
      },
      {
        "ruleId": "Q-NORMO-HIGH-001",
        "matched": false
      },
      {
        "ruleId": "Q-NORMO-HIGH-002",
        "matched": false
      },
      {
        "ruleId": "Q-NORMO-LOW-001",
        "matched": false
      },
      {
        "ruleId": "Q-MACRO-001",
        "matched": false
      },
      {
        "ruleId": "Q-MACRO-002",
        "matched": false
      },
      {
        "ruleId": "Q-SMEAR-001",
        "matched": false
      },
      {
        "ruleId": "Q-CYT-001",
        "matched": false
      },
      {
        "ruleId": "ALERT-LEAD-CAPILLARY",
        "matched": false
      }
    ]
  }
}
